,Song & Artist,Lyrics,Word Count
17,"('Pocketful Of Sunshine', 'Natasha Bedingfield')","Oh, yeah, yeah, yeah I got a pocket, got a pocketful of sunshine I got a love and I know that it's all mine, oh, oh-oh Do what you want, but you're never gonna break me Sticks and stones are never gonna shake me, oh, oh-oh Take me away (Take me away) A secret place (A secret place) A sweet escape (A sweet escape) Take me away (Take me away) Take me away (Take me away) To better days (To better days) Take me away (Take me away) A hiding place (A hiding place) I got a pocket, got a pocketful of sunshine I got a love and I know that it's all mine, oh, oh-oh (Got a pocket, got a pocketful of sunshine, got a love, and I know that it's all mine) Do what you want, but you're never gonna break me, oh Sticks and stones are never gonna shake me, oh, oh-oh (Never gonna shake me, never gonna shake me) I got a pocket, got a pocketful of sunshine I got a love and I know that it's all mine, oh, oh-oh (I know, I know that it's all mine) Wish that you could, but you ain't gonna own me Do anything you can to control me, oh, oh no (You can't control me, you can't control me) Take me away (Take me away) A secret place (A secret place) A sweet escape (A sweet escape) Take me away (Take me away) Take me away (Take me away) To better days (To better days) Take me away (Take me away) A hiding place (A hiding place) There’s a place that I go, that nobody knows Where the rivers flow, and I call it home And there's no more lies, in the darkness, there's light And nobody cries, there's only butterflies Take me away (Take me away) A secret place (A secret place) A sweet escape (A sweet escape) Take me away (Take me away) Take me away (Take me away) To better days (To better days) Take me away (Take me away) A hiding place (A hiding place) Take me away (Take me away) A secret place (A secret place) A sweet escape (A sweet escape) Take me away (Take me away) Take me away (Take me away) To better days (To better days) Take me away (Take me away) A hiding place (A hiding place) Take me away (I got a pocket, got a pocketful of sunshine) A secret place (I got a love and I know that it's all mine, oh) To better days (To better days) Take me away (Take me away) Take me away (I got a pocket, got a pocketful of sunshine) (I got a love and I know that it's all mine, oh) To better days (To better days) Take me away (Take me away) A hiding place (A hiding place) Oh yeah, oh The sun is on my side, and takes me for a ride I smile up to the sky, I know I'll be alright The sun is on my side, and takes me for a ride I smile up to the sky, I know I'll be alright",529
18,"('Kiss Kiss', 'Chris Brown Featuring T-Pain')","Yo, this is Nappy Boy Radio live With your boy T-Pain, we love rap music Listen, uh, we got a caller on line one Caller, what's your problem? Hello, I'm on the radio with T-Pain! How's it going? Yeah It ain't going good, my girl ain't doing her things she used to do, at all I got just what you need, brand new Chris Brown, T-Pain (Okay) You heard it here first, Nappy Boy Radio, we, love, you What them boys gon' do for me? Aw Hey, she want that lovey-dovey, lovey-dovey That kiss kiss, kiss kiss In her mind she fantasize 'bout getting with me They hating on me, hating on me They wanna diss diss, diss this Because she mine and so fine, thick as can be Hey, she want that lovey-dovey, lovey-dovey That kiss kiss, kiss kiss In her mind she fantasize 'bout getting with me They hating on me, hating on me They wanna diss this, diss this Because she mine and so fine, thick as can be I'm a country boy from Tappahannock (Ah-woo) V.A. is where I reside, so shawty understand it (Ah-woo) And I know I just turned eighteen and I get a little mannish (Ah-woo) And you see this bandana hangin' That means I'm like a bandit, like, like a bandit, bandit (Ah, woo!) I got paper, girl (Woo!) The Lamborghini (Woo!) With the spider seats (Woo!) You never seen it (Ah, woo!) So get it, shawty We parkin' lot pimpin' in my donk And I know what you want Hey, she want that lovey-dovey, lovey-dovey That kiss kiss, kiss kiss In her mind she fantasize 'bout getting with me They hating on me, hating on me They wanna diss diss, diss this Because she mine and so fine, thick as can be Hey, she want that lovey-dovey, lovey-dovey That kiss kiss, kiss kiss In her mind she fantasize 'bout getting with me They hating on me, hating on me They wanna diss this, diss this Because she mine and so fine, woah, thick as can be I'm the epitome of this demonstration, I got the remedy You feelin' me, so why is you hatin' on my anatomy? It's bird-like, yeah, you heard right Girl, I'm the king, so that means I'm fly (Ah, woo!) If you with it, girl (Woo!) Get it poppin' (Woo!) Roll with me (Woo!) Ain't no stoppin' (Ah, woo!) So get it, shawty We parkin' lot pimpin' in my donk And I know what you want Hey, she want that lovey-dovey, lovey-dovey That kiss kiss, kiss kiss (Hey) In her mind she fantasize 'bout (Hey), getting with me They hating on me, hating on me (Yeah) They wanna diss diss, diss this Because she mine and so fine, thick as can be (Thick as can be, yeah) Hey, she want that lovey-dovey, lovey-dovey That kiss kiss, kiss kiss In her mind she fantasize 'bout getting with me, yeah They hating on me, hating on me They wanna diss this, diss this (Hey) Because she mine and so fine, (Hey), thick as can be Ayy, ayy, ayy, ayy Shawty, let me holla at you, you so hot, hot, hot, hot You think I'd be hollerin' if you not, not, not, not? I'm king of the town, you can take a look around Teddy Penderazdown is in the spot, spot, spot, spot Yeah, I got money on me Yeah, baby girl, no problem Yeah, you rollin', shawty? Yeah, let's hit McDonald's (Ha!) It's TP, and CB I'm a Nappy Boy, ah-ow-ah-ah-ah-oh-ooh-wee Hey, she want that lovey-dovey, lovey-dovey (Oh-oh) That kiss kiss, kiss kiss In her mind she fantasize 'bout (Oh, woah), getting with me (Woah) They hating on me, hating on me They wanna diss diss, diss this Because she mine and so fine, so fine, thick as can be Hey, she want that lovey-dovey, lovey-dovey (Girl) That kiss kiss, kiss kiss (Yeah) In her mind she fantasize 'bout getting with me, getting with me, shawty They hating on me, hating on me They wanna diss this, diss this T-Pain, Chris Brown Because she mine and so fine, thick as can be Yeah, yeah We are live back on Nappy Boy Radio (Oh, oh) This is your boy DJ Pain (Yeah) I gotta get outta here, man, I just wanna leave with Told y'all I was gon' do it like this, ha If you ain't got it by now (Yeah), then you just ain't getting it, yeah Let's go, Nappy Boy (Ayy) and Pretty Boy (Ayy) Nappy Boy (Ayy) and Pretty Boy (Ayy) Boy, I say, Nappy Boy and Pretty Boy Hit us up, man, (850) 321-8692 Nappy, Nappy, Nappy and Pretty Boy",784
19,"('Closer', 'Ne-Yo')","Turn the lights off in this place And she shines just like a star And I swear I know her face I just don't know who you are Turn the music up in here I still hear her loud and clear Like she's right there in my ear Telling me that she wants to own me To control me Come closer Come closer And I just can't pull myself away Under her spell I can't break I just can't stop I just can't stop I just can't stop I just can't stop And I just can't bring myself no way But I don't want to escape I just can't stop I just can't stop I just can't stop I just can't stop I can feel her on my skin I can taste her on my tongue She's the sweetest taste of sin The more I get the more I want She wants to own me Come closer Come closer And I just can't pull myself away Under her spell I can't break I just can't stop I just can't stop I just can't stop I just can't stop And I just can't bring myself no way But I don't want to escape I just can't stop I just can't stop I just can't stop I just can't stop Come closer Come closer Come closer Come closer I just can't stop, no no I just can't stop, no no I just can't stop, no no I just can't stop, no no No, no, no, no And I just can't pull myself away Under her spell I can't break I just can't stop I just can't stop I just can't stop I just can't stop And I just can't bring myself no way But I don't want to escape I just can't stop I just can't stop I just can't stop I just can't stop And I just can't pull myself away Under her spell I can't break I just can't stop I just can't stop I just can't stop I just can't stop Come closer",344
20,"('Bubbly', 'Colbie Caillat')","Will you count me in? I've been awake for a while now You've got me feeling like a child now 'Cause every time I see your bubbly face I get the tingles in a silly place It starts in my toes and I crinkle my nose Wherever it goes, I always know That you make me smile, please stay for a while now Just take your time, wherever you go The rain is falling on my window pane But we are hiding in a safer place Under covers, staying dry and warm You give me feelings that I adore They start in my toes, make me crinkle my nose Wherever it goes, I always know That you make me smile, please stay for a while now Just take your time, wherever you go But what am I gonna say When you make me feel this way? I just... Mmm And it starts in my toes, makes me crinkle my nose Wherever it goes, I always know That you make me smile, please stay for a while now Just take your time, wherever you go Ta-da-dam, ta-da, da-dam, ta-da-dam, ta-da-da-da, ta-da-dam Um-ba, da-da, um-ba, ta-da-da-da, uhm, mm-mmh I've been asleep for a while now You tuck me in, just like a child now 'Cause every time you hold me in your arms I'm comfortable enough to feel your warmth It starts in my soul and I lose all control When you kiss my nose, the feeling shows 'Cause you make me smile, baby, just take your time now Holding me tight Wherever, wherever, wherever you go Wherever, wherever, wherever you go Wherever you go, I always know 'Cause you make me smile, even just for a while",286
21,"('Touch My Body', 'Mariah Carey')","Uh, uh, uh, in the place to be Oh yeah, oh yeah, oh yeah, oh yeah, oh yeah Oh yeah, oh yeah, oh yeah, oh yeah I know that you've been waiting for it, I'm waiting too In my imagination, I'd be all up on you I know you got that fever for me: hundred and two And boy, I know I feel the same My temperature's through the roof If there's a camera up in here Then it's gonna leave with me when I do, I do If there's a camera up in here Then I'd best not catch this flick on YouTube, YouTube 'Cause if you run your mouth And brag about this secret rendezvous I will hunt you down 'Cause they be all up in my business like a Wendy interview But this is private, 'tween you and I Touch my body, put me on the floor Wrestle me around, play with me some more Touch my body, throw me on the bed I just wanna make you feel like you never did Touch my body, let me wrap my thighs All around your waist, just a little taste Touch my body, know you like my curves Come on and give me what I deserve And touch my body Boy, you can put me on you like a brand new white tee I'll hug your body tighter than my favorite jeans I want you to caress me like a tropical breeze And float away with you in the Caribbean Sea If there's a camera up in here Then it's gonna leave with me when I do, I do If there's a camera up in here Then I'd best not catch this flick on YouTube, YouTube 'Cause if you run your mouth And brag about this secret rendezvous I will hunt you down 'Cause they be all up in my business like a Wendy interview But this is private, 'tween you and I Touch my body, put me on the floor Wrestle me around, play with me some more Touch my body, throw me on the bed I just wanna make you feel like you never did Touch my body, let me wrap my thighs All around your waist, just a little taste Touch my body, know you like my curves Come on and give me what I deserve And touch my body I'ma treat you like a teddy bear You won't wanna go nowhere In the lap of luxury Laying intertwined with me (La-la-la-la-da-da-da) You won't want for nothing, boy (No) I will give you plenty joy (Touch my body!) Touch my body, put me on the floor (Throw me on the floor) Wrestle me around, play with me some more (Ooh, touch my body) Touch my body, throw me on the bed I just wanna make you feel like you never did Touch my body, let me wrap my thighs (Let me wrap my thighs) All around your waist, just a little taste (Around your waist, for just a little taste) Touch my body, know you like my curves (I know you like it) Come on and give me what I deserve (Give me what I deserve, babe!) And touch my body Oh yeah, oh yeah, oh yeah, oh yeah (Yeah, yeah) Oh yeah, oh-oh-oh-oh (Every little way you like to touch my body, baby) Touch my body Oh yeah, oh yeah, oh yeah, oh yeah Oh yeah, oh-oh-oh-oh Just touch my body Yeah, ooh-ooh, baby Oh, ooh-ooh Touch my body Uh, ooh-ooh-ooh Come on and give me what I deserve! Touch my body Oh! Ooh-ooh, ooh... Touch my body",604
22,"('4 Minutes', 'Madonna Featuring Justin Timberlake & Timbaland')","I'm outta time, and all I got is four minutes Fikki fikki, four minutes, aye I'm outta time, and all I got is four minutes Fikki fikki, four minutes, aye I'm outta time, and all I got is four minutes (Four, four) Fikki fikki, four minutes, aye I'm outta time, and all I got is four minutes (Four, four) Fikki fikki, four minutes, aye I'm outta time, and all I got is four minutes (Four, four) Fikki fikki, four minutes, aye I'm outta time, and all I got is four minutes (Four, four) Fikki fikki, four minutes, aye I'm outta time, and all I got is four minutes (Four, four) Fikki fikki, four minutes, aye I'm outta time, and all I got is four minutes (Four, four) Fikki fikki, ow, ow, c'mon Ah, yeah, ha, breakdown, c'mon Hey, uh, c'mon, Madonna C'mon, boy I've been waiting for somebody to pick up my stroll, ah Ah, well, don't waste time Give me a sign, tell me how you wanna roll, mmm I want somebody to speed it up for me, then take it down slow There's enough room for both Well, I can handle that, you just gotta show me where it's at Are you ready to go? Are you ready to go? (Fikki fikki, fikki fikki, come on) If you want it, you already got it If you thought it, it better be what you want (Fikki, fikki, ow) If you feel it, it must be real just Say the word, and I'mma give you what you want Time is waiting We only got four minutes to save the world No hesitating Grab a boy, then grab a girl Time is waiting We only got four minutes to save the world No hesitating We only got four minutes, heh, a-four minutes So keep it up, keep it up Don't be a pri-hey-Madonna, uh You gotta get in line, hop (Tick tock, tick tock, tick tock) That's right, keep it up, keep it up Don't be a pri-hey-Madonna, uh You gotta get in line, hop (Tick tock, tick tock, tick tock) Sometimes I think what I need is a ""you"" intervention, yeah And you know I can tell that you like it And that it's good, by the way that you move, oh, hey The road to hell is paved with good intentions, yeah But if I die tonight, at least I can say I did what I wanted to do Tell me, how 'bout you? (Fikki, fikki, ow) If you want it, you already got it If you thought it, it better be what you want (Come on) If you feel it, it must be real just Say the word, and I'mma give you what you want The time is waiting We only got four minutes to save the world No hesitating Grab a boy, then grab a girl Time is waiting We only got four minutes to save the world No hesitating We only got four minutes, heh, a-four minutes So keep it up, keep it up Don't be a pri-hey-Madonna, uh You gotta get in line, hop (Tick tock, tick tock, tick tock) That's right, keep it up, keep it up Don't be a pri-hey-Madonna, uh You gotta get in line, hop (Tick tock, tick tock, tick tock) Breakdown, yeah (Tick tock, tick tock, tick tock) Yeah, uh (Tick tock, tick tock, tick tock) I only got four minutes, to save the world",575
23,"('So What', 'P!nk')","Na-na-na-na-na-na-na, na-na-na-na-na-na Na-na-na-na-na-na-na, na-na-na-na-na-na I guess I just lost my husband I don't know where he went So I'm gonna drink my money I'm not gonna pay his rent (Nope) I got a brand new attitude And I'm gonna wear it tonight I wanna get in trouble I wanna start a fight Na-na-na-na-na-na-na, I wanna start a fight Na-na-na-na-na-na-na, I wanna start a fight So, so what? I'm still a rock star I got my rock moves And I don't need you And guess what? I'm havin' more fun And now that we're done I'm gonna show you tonight I'm alright, I'm just fine And you're a tool, so So what? I am a rock star I got my rock moves And I don't want you tonight Uh, check my flow, uh The waiter just took my table And gave it to Jessica Simp (Shit) I guess I'll go sit with drum boy At least he'll know how to hit (Oops) What if this song's on the radio? Then somebody's gonna die I'm gonna get in trouble My ex'll start a fight Na-na-na-na-na-na-na, he's gonna start a fight (Huh) Na-na-na-na-na-na-na, we're all gonna get in a fight So, so what? I'm still a rock star I got my rock moves And I don't need you And guess what? I'm havin' more fun And now that we're done I'm gonna show you tonight I'm alright (I'm alright), I'm just fine And you're a tool, so So what? I am a rock star I got my rock moves And I don't want you tonight You weren't there, you never were You want it all, but that's not fair I gave you life, I gave my all You weren't there, you let me fall So, so what? I'm still a rock star I got my rock moves And I don't need you And guess what? I'm havin' more fun And now that we're done (We're done) I'm gonna show you tonight I'm alright (I'm alright), I'm just fine (I'm just fine) And you're a tool, so So what? I am a rock star (Oh) I got my rock moves And I don't want you tonight (I don't want you tonight) No, no No, no I don't want you tonight You weren't there I'm gonna show you tonight (I'm gonna show you tonight) I'm alright (I'm alright), I'm just fine And you're a tool, so So what? I am a rock star I got my rock moves And I don't want you tonight (I don't want you tonight)",424
24,"('Paralyzer', 'Finger Eleven')","I hold on so nervously to me and my drink I wish it was cooling me But so far has not been good, it's been shitty And I feel awkward as I should This club has got to be the most pretentious thing Since I thought you and me Well, I am imagining a dark lit place Or your place or my place Well, I'm not paralyzed, but I seem to be struck by you I wanna make you move because you're standing still If your body matches what your eyes can do You'll probably move right through me on my way to you I hold out for one more drink, before I think I'm looking too desperately But so far has not been fun, I should just stay home If one thing really means one This club will hopefully be closed in three weeks That would be cool with me Well, I'm still imagining a dark lit place Or your place or my place Well, I'm not paralyzed, but I seem to be struck by you I wanna make you move because you're standing still If your body matches what your eyes can do You'll probably move right through me on my way to you Well, I'm not paralyzed, but I seem to be struck by you I wanna make you move because you're standing still If your body matches what your eyes can do You'll probably move right through me on my way to you Not paralyzed, but I seem to be struck by you I wanna make you move because you're standing still If your body matches what your eyes can do You'll probably move right through me on my way to you You'll probably move right through me on my way to you You'll probably move right through me on my way to you",308
25,"('Clumsy', 'Fergie')","She can't help it, the girl can't help it (Oh, baby!) She can't help it, the girl can't help it (Oh, baby!) She can't help it, the girl can't help it (Oh, baby!) She can't help it First time that I saw your eyes Boy, you looked right through me, mmm, mmm Played it cool, but I knew you knew That cupid hit me, mmm, mmm You got me trippin' (Oh), stumblin' (Oh), flippin' (Oh), fumblin' Clumsy 'cause I'm fallin' in love (In - in, love - love) You got me slippin' (Oh), tumblin' (Oh), sinkin' (Oh), crumblin' Clumsy 'cause I'm fallin' in love (In - in, love - love) So in love with you She can't help it, the girl can't help it (Oh, baby!) She can't help it, the girl can't help it (Oh, no!) She can't help it, the girl can't help it (No how!) She can't help it Can't breathe, when you touch my sleeve Butterflies so crazy, mmm, mmm Whoa now, think I'm goin' down Friends don't know what's with me, mmm, mmm You got me trippin' (Oh), stumblin' (Oh), flippin' (Oh), fumblin' Clumsy 'cause I'm fallin' in love (In - in, love - love) You got me slippin' (Oh), tumblin' (Oh), sinkin' (Oh), crumblin' Clumsy 'cause I'm fallin' in love (In - in, love - love) So in love with you She can't help it, the girl can't help it (Oh, no!) She can't help it, the girl can't help it (Oh, please!) She can't help it, the girl can't help it (Oh, no!) She can't help it You know, this ain't the first time this has happened to me This ""love sick"" thing I like serious relationships and, uh A girl like me don't stay single for long 'Cause every time a boyfriend and I break up My world is crushed and I'm all alone The love bug comes right back up and bites me And I'm back! She can't help it, the girl can't help it (In love!) She can't help it, the girl can't help it (Oh, God!) She can't help it, the girl can't help it (I'm back in love!) Can't help it (Ooh, whoo, ooh!) She can't help it, the girl can't help it (I'm back in love now!) She can't help it, the girl can't help it (I'm back in love now, baby!) She can't help it, the girl can't help it (I'm back in love now!) She can't help it (And now you got me) You got me trippin' (Oh), stumblin' (Oh), flippin' (Oh), fumblin' Clumsy 'cause I'm fallin' in love (In - in, love - love) You got me slippin' (Oh), tumblin' (Oh), sinkin' (Oh), crumblin' Clumsy 'cause I'm fallin' in love (In - in, love - love) So in love with you Clumsy 'cause I'm fallin' in love (In - in, love - love) You got me slippin' (Oh), tumblin' (Oh), sinkin' (Oh), crumblin' Clumsy 'cause I'm fallin' in love (In - in, love - love) So in love with you So in love with you So in love with you",516
26,"(""I'm Yours"", 'Jason Mraz')","Well you done done me in; you bet I felt it I tried to be chill but you're so hot that I melted I fell right through the cracks Now I'm trying to get back Before the cool done run out I'll be giving it my bestest Nothing's going to stop me but divine intervention I reckon it's again my turn to win some or learn some But I won't hesitate no more, no more It cannot wait, I'm yours Well open up your mind and see like me Open up your plans and damn you're free Look into your heart and you'll find Love, love, love, love Listen to the music of the moment, people dance and sing We're just one big family And it's our God-forsaken right to be Loved, love, love, love, loved So I won't hesitate no more, no more It cannot wait, I'm sure There's no need to complicate Our time is short This is our fate, I'm yours Do you want to come on scootch on over closer, dear And I will nibble your ear I've been spending way too long checking my tongue in the mirror And bending over backwards just to try to see it clearer But my breath fogged up the glass And so I drew a new face and I laughed I guess what I be saying is there ain't no better reason To rid yourself of vanities and just go with the seasons It's what we aim to do Our name is our virtue But I won't hesitate no more, no more It cannot wait – I'm yours Well open up your mind and see like me (I won't hesitate) Open up your plans and damn you're free (No more, no more) Look into your heart and you'll find (It cannot wait) The sky is yours (I'm sure) So please don't, please don't, please don't (No need to complicate) There's no need to complicate (Our time is short) 'Cause our time is short (This is) This oh, this oh, this is our fate (our fate) I'm yours",348
