,Song & Artist,Lyrics,Word Count
71,"('Too Little Too Late', 'JoJo')","Mmh no, mmh... Come with me, stay the night You say the words, but boy, it don't feel right What do ya expect me to say? (You know it's just too little too late) You take my hand, and you say you've changed But boy, you know your begging don't fool me Because to you, it's just a game (You know it's just too little too late) So let me on down 'Cause time has made me strong I'm starting to move on I'm gonna say this now Your chance has come and gone And you know... It's just too little too late A little too wrong, and I can't wait But you know all the right things to say You know it's just too little too late You say you dream of my face But you don't like me, you just like the chase To be real, it doesn't matter anyway You know it's just too little too late Yeah, yeah It's just too little too late I was young and in love I gave you everything, but it wasn't enough And now you wanna communicate Huh (You know it's just too little too late) Go find someone else In letting you go, I'm loving myself You got a problem But don't come asking me for help 'Cause you know... It's just too little too late A little too wrong, and I can't wait But you know all the right things to say You know it's just too little too late You say you dream of my face But you don't like me, you just like the chase To be real, it doesn't matter anyway You know it's just too little too late I can love with all of my heart, baby I know I have so much to give (I've got so much to give) With a player like you, I don't have a prayer That's no way to live, oh, oh-ooh Mmh no, whoa whoa It's just too little too late Yeah, yeah! It's just too little too late (Too late, babe) A little too wrong, and I can't wait (Yeah, yeah, yeah) But you know all the right things to say (Woo!) You know it's just too little too late You say you dream of my face But you don't like me, you just like the chase (You just like the chase baby) To be real, it doesn't matter anyway (Hey, hey) You know it's just too little too late (Ah, ooh, ooh-ooh-ooh) Yeah, yeah, yeah, yeah You know it's just too little too late (Ooh) I can't wait, no, no, no... It's just too little too late A little too wrong, and I can't wait But you know all the right things to say (Yeah, yeah, yeah) You know it's just too little too late You say you dream of my face But you don't like me, you just like the chase To be real, it doesn't matter anyway You know it's just too little too late",502
72,"('Touch It', 'Busta Rhymes')","(Ayo Swizz I don't think they ready for this shit) Touch it, bring it, pay it, watch it (Aiyyo let me take they ass back to the club real quick) Turn it, leave it, start - format it Touch it, bring it, pay it, watch it Turn it, leave it, start - format it Touch it, bring it, pay it, watch it Turn it, leave it, start - format it Touch it, bring it, pay it, watch it Turn it, leave it, start - format it Touch it, bring it, pay it, watch it Turn it, leave it, start - format it (Get low Bus!) Who be the King of the Sound? (Uh huh) Busta Bus back to just put a lock on a town (Uh huh) Lot of my bitches be comin' from miles around See they be comin' cause they know how the God get down (Turn it up!) Now you know who holdin' the throne so gimme the crown Niggas salutin' and tryna give me a pound (Come on) I don't really fuck with you niggas, you niggas is clowns Making the bitches strippin', throw they shit on the ground (Get low Bus!) Now that's the way that it goes (Uh huh) When we up in the spot the shit be flooded with hoes (Come on) See we a make it hot, the chicks will come out their clothes That's when you get it, mami already know I suppose (Turn it up!) Shorty wildin' and Shorty open, she beastin' it out For the record, just a second I'm freaking it out (Come on) While she tryna touch see I was peepin' it out She turned around and was tryna put my dick in her mouth I let her Touch it, bring it, pay it, watch it Turn it, leave it, start - format it Touch it, bring it, pay it, watch it Turn it, leave it, start - format it Touch it, bring it, pay it, watch it Turn it, leave it, start - format it Touch it, bring it, pay it, watch it Turn it, leave it, start - format it (Get low Bus!) And as we started, got me ringin' her bell (Uh huh) When I come I be doin' it and doin' it well (Uh huh) Then I beat up the coochie and be makin' it swell Tryna hide the smell of the sex, spraying on the Chanel (Turn it up!) Then they try to walk with a strut so no one could tell (Come on) How a nigga got in they butt, made everything jail (Come on) Now the chick will wild like a nut, she blowin' my cell (Come on) Can't get enough of the kid, I put her under my spell (Get low Bus!) It's crowded, mami, move it along (Uh huh) If you know you 'bout it then get to removin' your thong (Uh huh) To the whip and back of the truck that's where you belong After the yac, see the type of raunchy shit they be on (Turn it up!) Street niggas respect it because my movement is strong (Come on) 'Cause we consistently rep and see my money is long All my bitches is wit' me, see how they singing the song Plus how we give 'em the stick and we be dickin' along I let her Touch it, bring it, pay it, watch it Turn it, leave it, start - format it Touch it, bring it, pay it, watch it Turn it, leave it, start - format it Touch it, bring it, pay it, watch it Turn it, leave it, start - format it Touch it, bring it, pay it, watch it Turn it, leave it, start - format it (Get low Bus!) The God of the block, see that I'm back (Uh huh) Every single time that I drop, the shit is a wrap (Uh huh) For the niggas hatin' the kid I'm close to the strap Cause all these bitches wanna come talk to sit on my lap (TURN IT UP!!) Every time I give you bang shit to knock in ya whip (Come on) Nigga always do his thing, bitch, lockin' the strip (Come on) Lot of mamis is dancin' and they shakin' their hips After that they get low and put the thing on their lips I let them Touch it, bring it, pay it, watch it Turn it, leave it, start - format it Touch it, bring it, pay it, watch it Turn it, leave it, start - format it Touch it, bring it, pay it, watch it Turn it, leave it, start - format it Touch it, bring it, pay it, watch it Turn it, leave it, start - format it",791
73,"('Rompe', 'Daddy Yankee')","You know Los capos están ready Las mamis están ready Y en la calle estamos ready Yeah, yeah, andamos ready Los barrios están ready One, two, get ready, come on! Oh, oh, oh, oh! Rompe, rompe, rompe, bien guilla'o Rompe, rompe, rompe, ese cuerpo ella lo— Rompe, rompe, rompe, bien guilla'o Are you ready!? Rompe, rompe, rompe, break it down Rompe, rompe, rompe, the way she moves, ella lo— Rompe, rompe, rompe, break it down Let's go My boo, no se limita a la hora de romper su pum-pum Con curvas más calientes que el sur, right through Enséñame si tienes la actitud, mami Dale, go! Dale, go! Dale, go! Go! Tiempo; llegó el momento, baby, de perder el control Trabájame ese cuerpo más que un shot de Winstrol Sube ese temperamento, dame movimiento Lento, lento, ella lo— Rompe, rompe, rompe, bien guilla'o Rompe, rompe, rompe, ese cuerpo ella lo— Rompe, rompe, rompe, bien guilla'o Are you ready!? Rompe, rompe, rompe, break it down Rompe, rompe, rompe, the way she moves, ella lo— Rompe, rompe, rompe, break it down G-Go! G-Go! G-Go! G-Go! Voy chillin', tranquilo, that's right Buscando una gata que cae No escondas todo eso que traes Yo', baby, ¿qué es la que hay? Voy chillin', tranquilo, that's right Buscando una gata que cae No escondas todo eso que trae' ¿Qué pasa, socio, qué es la que hay? (What!? What!? What!? What!?) Pinche, güey, ¿pensaste que esto era un mamey? No vo' a dar break, deja ese guille de Scarface Get out my way, usted no vende ni en eBay No das pa' na', conmigo 'tás Frito-Lay Chequea el swing Que se le pega a to'as las nenas más que un G-string Yo soy la pesadilla de todo' los dream team Ya se te acabó el magazine Conmigo no te la guilles, pa', de Listerine Daddy te— Rompe, rompe, rompe, bien guilla'o Rompe, rompe, rompe, ese cuerpo ella lo— Rompe, rompe, rompe, bien guilla'o Are you ready!? Rompe, rompe, rompe, break it down Rompe, rompe, rompe, the way she moves, ella lo— Rompe, rompe, rompe, break it down Let's go You know! Oh!, oh! En Directo Oh!, oh! Daddy Yankee, yo' Con Los Jedis, Monserrate & DJ Urba Fish! Jaja It's official! Daddy Yankee! Cartel Records En Directo Who's this?",382
74,"('Deja Vu', 'Beyonce Featuring Jay Z')","Bass (Uh) Hi-hat (Uh) 808 (Uh) Jay (Uh-huh, ready, uh-huh) Let's go get 'em (Uh-huh) C'mon (C'mon) I used to run base like Juan Pierre Now I run the bass hi-hat and the snare I used to bag girls like Birkin Bags Now I bag B (Boy, you hurtin' that) Brooklyn Bay where they birthed me at Now I be everywhere, the nerve of rap The audacity to have me with them curtains back Me and B, she about to sting, stand back Baby, seem like everywhere I go, I see you From your eyes, I smile, it's like I breathe you Helplessly, I reminisce, don't want to Compare nobody to you Boy, I try to catch myself, but I'm outta control Your sexiness is so appealing, I can't let it go Know that I can't get over you 'Cause everything I see is you And I don't want no substitute Baby, I swear it's Déjà Vu Know that I can't get over you 'Cause everything I see is you And I don't want no substitute Baby, I swear it's Déjà Vu Seeing things that I know can't be, am I dreaming? When I saw you walkin' past me, almost called your name Got a better glimpse and then I looked away Feels like I'm losin' it Boy, I try to catch myself, but I'm outta control Your sexiness is so appealing, I can't let it go Know that I can't get over you 'Cause everything I see is you And I don't want no substitute Baby, I swear it's Déjà Vu Know that I can't get over you 'Cause everything I see is you And I don't want no substitute Baby, I swear it's Déjà Vu Yes, Hova's flow so unusual Baby girl, you should already know It's H-O, light up the dro 'Cause you gon' need help tryna study my bounce Flow, blow, what's the difference? One you take in vein while the other you sniffin' It's still dope, po-po try to convict him Thats a no-go, my dough keep the scales tippin' Like 4-4s, like I'm from the H-O-U-S-T-O-N Blow wind, so Chicago of him Is he the best ever? That's the argu-a-ment I don't make the list, don't be mad at me I just make the hits like a factory I'm just one of, the one, nothin' after me No Déjà Vu, just me and my... (Oh!) Baby, I can't go anywhere Without thinking that you're there Seems like you're everywhere, it's true Gotta be having Deja Vu 'Cause in my mind, I want you here Get on the next plane, I don't care Is it because I'm missin' you That I'm having Déjà Vu? Boy, I try to catch myself, but I'm outta control Your sexiness is so appealing, I can't let it go Know that I can't get over you 'Cause everything I see is you And I don't want no substitute Baby, I swear it's Déjà Vu Know that I can't get over you 'Cause everything I see is you And I don't want no substitute Baby, I swear it's Déjà Vu Know that I can't get over you 'Cause everything I see is you And I don't want no substitute Baby, I swear it's Déjà Vu Know that I can't get over you 'Cause everything I see is you And I don't want no substitute Baby, I swear it's Déjà Vu",569
75,"('Life Is A Highway', 'Rascal Flatts')","Hmm, yeah Life's like a road that you travel on When there's one day here and the next day gone Sometimes you bend, sometimes you stand Sometimes you turn your back to the wind There's a world outside every darkened door Where blues won't haunt you anymore Where the brave are free and lovers soar Come ride with me to the distant shore We won't hesitate To break down the garden gate There's not much time left today, yeah Life is a highway I wanna ride it all night long If you're goin' my way I wanna drive it all night long Through all these cities and all these towns It's in my blood and it's all around I love you now like I loved you then This is the road and these are the hands From Mozambique to those Memphis nights The Khyber Pass to Vancouver's lights Knock me down, I'm back up again You're in my blood, I'm not a lonely man There's no load I can't hold The roads are rough, this I know I'll be there when the light comes in Just tell 'em we're survivors Life is a highway I wanna ride it all night long (Woo) If you're goin' my way I wanna drive it all night long (All night long) A gimme, gimme, gimme, gimme, yeah Life is a highway I wanna ride it all night long (Hmm, yeah) If you're goin' my way (You're goin' my way) I wanna drive it all night long (All night long) There was a distance between you and I (Between you and I) A misunderstanding once But now we look it in the eye Ooh, yeah (Hmm, yeah) There ain't no load that I can't hold The roads are rough, this I know I'll be there when the light comes in Tell 'em we're survivors Life is a highway I wanna ride it all night long (All night long, yeah) If you're goin' my way I wanna drive it all night long (A gimme, gimme, gimme, a gimme, gimme, yeah) Life is a highway (Life is a highway) I wanna ride it all night long (Woo, yeah) If you're goin' my way (Goin' my way) I wanna drive it all night long (All night long, yeah; come on, gimme, gimme, gimme, gimme, gimme, gimme, yeah) Life is a highway I wanna ride it all night long (Yeah, I wanna drive it all night long, baby) If you're goin' my way (You're goin' my way) I wanna drive it all night long (All night long)",428
76,"(""Call Me When You're Sober"", 'Evanescence')","Don't cry to me If you loved me You would be here with me You want me Come find me Make up your mind Should I let you fall, lose it all? So maybe you can remember yourself Can't keep believing We're only deceiving ourselves And I'm sick of the lie And you're too late Don't cry to me If you loved me You would be here with me You want me Come find me Make up your mind Couldn't take the blame, sick with shame Must be exhausting to lose your own game Selfishly hated, no wonder you're jaded You can't play the victim this time And you're too late So don't cry to me If you loved me You would be here with me You want me Come find me Make up your mind You never call me when you're sober You only want it 'cause it's over, it's over How could I have burned paradise? How could I, you were never mine So don't cry to me If you loved me You would be here with me Don't lie to me Just get your things I've made up your mind",193
77,"('Jesus, Take The Wheel', 'Carrie Underwood')","She was drivin' last Friday on the way to Cincinnati On a snow-white Christmas Eve Goin' home to see her mama and her daddy With the baby in the backseat Fifty miles to go and she was runnin' low On faith and gasoline It'd been a long hard year She had a lot on her mind and she didn't pay attention She was goin' way too fast Before she knew it She was spinnin' on a thin black sheet of glass She saw both their lives flash before her eyes She didn't even have time to cry She was so scared She threw her hands up in the air Jesus, take the wheel Take it from my hands 'Cause I can't do this on my own I'm letting go So give me one more chance Save me from this road I'm on Jesus, take the wheel It was still gettin' colder when she made it to the shoulder And the car came to a stop She cried when she saw that baby in the backseat Sleepin' like a rock And for the first time in a long time She bowed her head to pray She said, ""I'm sorry for the way I've been livin' my life I know I've got to change So from now on tonight"" ""Jesus, take the wheel Take it from my hands 'Cause I can't do this on my own I'm letting go So give me one more chance Save me from this road I'm on Oh, Jesus, take the wheel Oh, I'm letting go So give me one more chance Save me from this road I'm on From this road I'm on Jesus, take the wheel Oh, take it, take it from me"" Oh, woah, ooh",291
78,"('Show Stopper', 'Danity Kane')","We in the car, we ride slow We doin' things that the girls don't do (Danity Kane) The boys stare, we smile back (Jim Jonsin) All my girls in the rainbow Cadillacs, yeah (It's Bad Boy, let's go) Show stoppin' at the latest spot The ride shinin' with the open top Hydraulics make our heads go nod Hair blowin' in the breeze, yo, we superstars Put in the keys, make that engine purr Three in the back, one in the passenger Slow creepin' 'cause we look that fly All the boys tryna taste our candy ride We in the car, we ride slow We doin' things that the girls don't do The boys stare, we smile back All my girls in the rainbow Cadillacs, yeah Bet you ain't never seen (Aye) chicks ridin' this clean (Aye) Louis Vuitton seats, we do it deadly (Oh, oh, oh) That's how we keep it poppin' (Aye), make sure that bass knockin' (Aye) So, when you see us ridin', we call it show stoppin' (Oh, oh, oh) We show stoppin', we show, show stoppin' We show stoppin', we show, show stoppin' That's how we keep it poppin' (Aye), make sure that bass knockin' (Aye) So, when you see us ridin', we call it show stoppin' (Oh, oh, oh) We sittin' on twenty-two's plus two Mink bucket seats, neon blue Color coordinate with them shoes Yeah, we divas but we ride like big boys do Black tinted with a white stripe interstate Lookin' in the mirror at my Bad Boy fitted, yup Show stoppin' till they lose they breath Turn the wheel to the right, turn the wheel to the left We in the car, we ride slow We doin' things that the girls don't do The boys stare, we smile back All my girls in the rainbow Cadillacs, yeah Bet you ain't never seen (Aye) chicks ridin' this clean (Aye) Louis Vuitton seats, we do it deadly (Oh, oh, oh) That's how we keep it poppin' (Aye), make sure that bass knockin' (Aye) So, when you see us ridin', we call it show stoppin' (Oh, oh, oh) We show stoppin', we show, show stoppin' We show stoppin', we show, show stoppin' That's how we keep it poppin' (Aye), make sure that bass knockin' (Aye) So, when you see us ridin', we call it show stoppin' (Oh, oh, oh) This is for my ladies in the 280's Mercedes In the H3 Baby Ranges, Bentley Coupes, my Escalades Say oh (Oh), oh (Oh, oh) Break 'em off somethin' proper like a real showstopper This is for my chicas with the Beamers A6's '67 Chevys, Maserati, or a Lexus Say oh (Oh), oh (Oh, oh) Break 'em off somethin' proper like a real showstopper Gon' jingle them keys, gon' jingle them keys Put 'em up real high, make sho' e'erybody see 'em One time (One time), two times (Two times) Three times (Three times), four times (Four times) Gon' jingle them keys, gon' jingle them keys Put 'em up real high, make sho' e'erybody see 'em One time (One time), two times (Two times) Three times (Three times), four times (Four times) We in the car, we ride slow We doin' things that the girls don't do The boys stare, we smile back All my girls in the rainbow Cadillacs, yeah Bet you ain't never seen (Aye) chicks ridin' this clean (Aye) Louis Vuitton seats, we do it deadly (Oh, oh, oh) That's how we keep it poppin' (Aye), make sure that bass knockin' (Aye) So, when you see us ridin', we call it show stoppin' (Oh, oh, oh) We show stoppin', we show, show stoppin' We show stoppin', we show, show stoppin' That's how we keep it poppin' (Aye), make sure that bass knockin' (Aye) So, when you see us ridin', we call it show stoppin' (Oh, oh, oh)",643
79,"('Get Up', 'Ciara Featuring Chamillionaire')","Ow, ow, ow Giddy up Get up, get up, get up (Ciara) He said, ""Hi, my name is so and so Baby, can you tell me yours? You look like you came to do one thing"" (Set it off) I started on the left Then I had to take him to the right He was out of breath But he kept on dancin' all night You tryin', admit it But you just can't fight the feeling inside You know it And I can see it in your eyes You want me You smooth as a mother You're so undercover By the way that you was watchin' me Ooh, uh The way you look at me, I'm feelin' you, uh I just can't help it, tryin' to keep it cool, uh I can feel it in the beat, uh When you do those things to me, uh Don't let nothin' stop you Move, ring the alarm The club is jumpin' now So get up I said, ""Ciara's on your radio Everybody turn it up"" Spicy just like hot sauce Careful, you might burn it up You can do the pop lock Rag-top, don't stop That's the way you gotta get Get it, make your body rock You trying, admit it But you just can't fight the feeling inside You know it 'Cause I can see it in your eyes You want me You smooth as a mother You're so undercover By the way that you was watchin' me Ooh, uh The way you look at me, I'm feelin' you, uh I just can't help it, tryin' to keep it cool, uh I can feel it in the beat, uh When you do those things to me, uh Don't let nothin' stop you Move, ring the alarm The club is jumpin' now So get up Ooh, I love the way you vibe with me Dance with me forever We can have a good time, follow me (Follow me) To the beat together (To the beat) You and me, one on one Breakin' it down You can't walk away now (Oh) We got to turn this place out Ooh, ooh It's the kid that stay ridin' big The one police tried to catch ridin' dirty In the club before eleven o'clock Like I'm tryna catch a dime kinda early Lookin' thick, her hair brown and curly She love the way my ride shinin' pearly City boys say she fine and pretty And the country boys say she fine and purty (Yeah) My pockets thick, it's green, it's curvy And the ladies know soon as they see my jewelry If bein' fresh to death is a crime I think it's time for me to see the jury You know Chamillionaire stay on the grind A hustler like me is hard to find I ain't really impressed, yes Unless it's about some dollar signs Ain't really no need to call you fine I know you be hearin' that all the time Watchin' you do your step, do your step And yep, it's going down Ooh, uh The way you look at me, I'm feelin' you, uh I just can't help it, tryin' to keep it cool, uh I can feel it in the beat, uh When you do those things to me, uh Don't let nothin' stop you Move, ring the alarm The club is jumpin' now So get up Ooh, uh The way you look at me, I'm feelin' you, uh I just can't help it, tryin' to keep it cool, uh I can feel it in the beat, uh When you do those things to me, uh Don't let nothin' stop you Move, ring the alarm The club is jumpin' now So get up I got to have you, baby Uh, I feel it I got to have you, baby I got to have you, baby Uh, I feel it I got to have you, baby",653
80,"(""We Be Burnin'"", 'Sean Paul')","Smokin' on that Cali Kush, my boy sells it by the bush I'm packin' heat with the .45 magnum in my belt Shawty lookin' so fine, wish I could've felt When I drugged the bitch, the drug I could've melt I'm feelin' so fine in the back of my Hummer Ridin' down a main street, I'm stuntin' like a winner I've been in the running for a long time I feel it's safe to say that DPalm can bust a bomb rhyme When I write down a verse, there ain't no controversy Look at your bitch, she's fifteen, call that statutory Smokin' on Arabian shit, don't you know? the good stuff The smoke hit the back of your throat, the shit is rough Told you suckers, DPalm gonna murder this investigation Who's the next bad rapper? Turnin' on a mutilator Fry you bitches up in, what is called frialator I worked at fast food, don't fuck with what I'm sayin' I don't wanna be the next rapper on TV I just wanna be me, enough about succeeding Smokin' spliffs and we be hittin' that Mauwie Wowie shit Drinkin 'til we daze-y, knockin' back down shots of Bacardi Parental advisory stickers all over my merchandise Like I was gonna put a ""Fuck you"" in front of my merchants' eyes Who the fuck is Dana Carvey? I'm the master of disguise Get as high as I am right now, and you'll be clappin' in the skies Don't be foolish, that plot's kinda like the flick ""Mission: Impossible"" Your homeboy's sayin' shit that got me actin' kinda pausible (Pause) That's A.K.A. for actin' gay Concoct your own acronym for ""Prez is gonna spray"" Best believe me, I'll do it, my words are the truest And I will throw some shit that leaves you lyin' in your fluids Young Money co-signer, please free Weezy So we can be broadcast live, like cable TV I'm new to this league, but great like John Wall We be burnin', Sean Paul, hard to kill, Steven Seagal We goin' in, like a robber, hide your toddler Windows we smash 'em, TVs we grab 'em, don't holler No problems, solutions we got 'em Melt your head off in layers, like a human Gobstopper Orville poppin', Smith & Wes Glockin' And we treat red lights like bed nights, and we ain't stoppin'You might also likeEmbed",395
