,Song & Artist,Lyrics,Word Count
32,"('Make Me Better', 'Fabolous Featuring Ne-Yo')","Timbo! Hey! Ne-Yo! Say what? Loso! Hey! Hey! I'm a movement by myself (Oh!) But I'm a force when were together Mami I'm good all by myself (Oh!) But baby you, you make me better You make me better, You make me better (Hey! Hey!) You make me better, You make me better (Hey! Hey!) You make me better, You make me better (Hey! Hey!) You make me better, You make me better (Hey! Hey! Hey!) You plus me, it equals better math Your boy a good look but she my better half I'm already bossin, already flossin But why have the cake if it ain't got the sweet frostin You're-You're-You're-You're keepin me on my A game With-With-With-Without havin the same name They-They-They-They-They-They might flame But-But-But-But shorty we burn it up The sag and my swag, pep in my step Daddy do the Gucci mami in Giuseppes Guess it's a G thing whenever we swing I'm a need Coretta Scott if I'm 'gon be King (Oooh) I'm a movement by myself (Oh!) But I'm a force when were together Mami I'm good all by myself (Oh!) But baby you, you make me better You make me better, You make me better (Hey! Hey!) You make me better, You make me better (Hey! Hey!) You make me better, You make me better (Hey! Hey!) You make me better, You make me better (Hey! Hey! Hey!) First thing's first, I does what I do But everything I am she's my improve I'm already bossin, I'm already fly But if I'm a star, she is the sky A-A-A-And when I feel like I'm on top She-She-She-She give me reason then I stop And-And-And-And-And-And though I'm hot To-To-To-Together we burn it up The caked up cut, the cleaned up ice The shorty come around, I clean up nice Dynamic duo, Batman and Robin Whoever don't like it is that man's problem And-And-And-And when I feel like I'm tired Ma-Ma-Ma-Mami be takin me higher I'm-I'm-I'm-I'm-I'm-I'm on fire But-But-But-But shorty we burn it up I'm a movement by myself (Oh!) But I'm a force when were together Mami I'm good all by myself (Oh!) But baby you, you make me better You make me better, You make me better (Hey! Hey!) You make me better, You make me better (Hey! Hey!) You make me better, You make me better (Hey! Hey!) You make me better, You make me better (Hey! Hey! Hey!) Cause on the side of every great man You could find a woman like a soldier holdin him down She treats me like a don, watches for the hit Checks where I go, even watches who I'm with The right when I'm wrong, so I never slip Show me how to move, that's why I never trip And baby girl you so major they should front page ya (Front page ya) God bless the parents who made ya (Who made ya) Middle finger anybody who hate the (Who hate the) Way we burn it up I'm a movement by myself (Oh!) But I'm a force when were together Mami I'm good all by myself (Oh!) But baby you, you make me better You make me better, You make me better (Hey! Hey!) You make me better, You make me better (Hey! Hey!) You make me better, You make me better (Hey! Hey!) You make me better, You make me better (Hey! Hey! Hey!) Yeah baby, them lames you playin with, they 'gon push you down We tryin to compliment you you know, make you better Top Notch Tim, Nice Look Ne-Yo, Livin Good Loso They ask you how you doin now, tell 'em better than them I'm a movement by myself (Oh!) But I'm a force when were together Mami I'm good all by myself (Oh!) But baby you, you make me better You make me better, You make me better (Hey! Hey!) You make me better, You make me better (Hey! Hey!) You make me better, You make me better (Hey! Hey!) You make me better, You make me better (Hey! Hey! Hey!)",680
33,"('Ice Box', 'Omarion')","Fussin' and fightin', we back at it again (Again) I know that it's my fault you don't understand (No) I got memories (Uh), this is crazy (Uh) You ain't nothing like the girl I used to know Good with ma, good with pa, cool with all my niggas (My niggas) I should try, truth is I wanna let you in, but (No) Damn these memories (Uh), and it's crazy (Uh) You ain't nothing like the girl I used to know (Ooh) Girl, I really wanna work this out 'cause I'm tired of fighting (Tired of fighting) And I really hope you still want me the way I want you (You, you) I said I really wanna work this out, damn, girl, I'm trying (I'm trying, yeah) It's no excuse, no excuse (But I got this) I got this icebox where my heart used to be (But I got this) Got this icebox where my heart used to be (Said I got it) I'm so cold, I'm so cold, I'm so cold, I'm so cold (No) I'm so cold, I'm so cold, I'm so cold (But I got this) I got this icebox where my heart used to be (Said I got this) Got this icebox where my heart used to be (No) I'm so cold, I'm so cold, I'm so cold, I'm so cold (No) I'm so cold, I'm so cold, I'm so cold Why can't I get it right? Just can't let it go (Go) I opened up, she let me down, I won't feel that no more (No) I got memories (Uh), this is crazy (Uh) She ain't nothing like the girl I used to know I don't mean to take it out on you, baby, but I can't help it 'Cause my heart is in the same ol' condition that baby left it (And I) I apologize (For makin' you cry) Look me in my eyes and promise you won't do me the same, yeah, yeah Girl, I really wanna work this out, 'cause I'm tired of fighting (Fighting) And I really hope you still want me the way I want you (Baby, I want you) I said I really wanna work this out, damn, girl, I'm trying (Oh, no, no) It's no excuse, no excuse I got this icebox where my heart used to be (Said I got this) Got this icebox where my heart used to be (Said I got it) I'm so cold, I'm so cold, I'm so cold, I'm so cold (No) I'm so cold, I'm so cold, I'm so cold I got this icebox where my heart used to be (Said I got this icebox) Got this icebox where my heart used to be (Ayy, yeah) I'm so cold, I'm so cold, I'm so cold, I'm so cold (No) I'm so cold, I'm so cold, I'm so cold I don't wanna be stuck off in this cold, cold world Don't wanna mess this up, better keep your eye on me, girl Don't wanna mess this up, better keep your eye on me, girl Don't wanna mess this up, better keep your eye on me, girl I don't wanna be stuck off in this cold, cold world ('Cause I don't wanna be) Don't wanna mess this up, better keep your eye on me, girl (Ooh, ooh-ooh) Don't wanna mess this up, better keep your eye on me, girl (Keep your eye on me) Don't wanna mess this up, better keep your eye on me, girl (Girl, oh) Girl, I really wanna work this out, 'cause I'm tired of fighting (Yeah) And I really hope you still want me the way I want you (Woo) I said I really wanna work this out, damn, girl, I'm trying (Yeah) It's no excuse, no excuse I said I got this icebox where my heart used to be Got this icebox where my heart used to be (No) I'm so cold, I'm so cold, I'm so cold, I'm so cold (No) I'm so cold, I'm so cold, I'm so cold (Yeah) Now I got this icebox where my heart used to be (Ooh) I got this icebox where my heart used to be (Oh) I'm so cold, I'm so cold, I'm so cold, I'm so cold (No) I'm so cold, I'm so cold, I'm so cold Girl, I really wanna work this out 'cause I'm tired of fighting (Fighting) Omarion, bitch",734
34,"('Lips Of An Angel', 'Hinder')","Honey, why you callin’ me so late? It’s kinda hard to talk right now Honey, why you cryin’? Is everything okay? I gotta whisper 'cause I can't be too loud Oh, well, my girl's in the next room Sometimes I wish she was you I guess we never really moved on It’s really good to hear your voice Sayin' my name, it sounds so sweet Comin' from the lips of an angel Hearin' those words, it makes me weak And I never wanna say goodbye But girl, you make it hard to be faithful With the lips of an angel It‘s funny that you're callin' me tonight And yes, I've dreamt of you too Does he know you're talkin’ to me Will it start a fight? No, I don't think she has a clue Oh, well, my girl's in the next room Sometimes I wish she was you I guess we never really moved on It’s really good to hear your voice Sayin' my name, it sounds so sweet Comin' from the lips of an angel Hearin' those words, it makes me weak And I never wanna say goodbye But girl, you make it hard to be faithful With the lips of an angel It's really good to hear your voice Sayin' my name, it sounds so sweet Comin' from the lips of an angel Hearin' those words, it makes me weak And I never wanna say goodbye But girl, you make it hard to be faithful With the lips of an angel (Never wanna say goodbye) But girl, you make it hard to be faithful With the lips of an angel Honey, why you callin’ me so late?",279
35,"('Waiting On The World To Change', 'John Mayer')","One, two One, two, three Me and all my friends We're all misunderstood They say we stand for nothing and There's no way we ever could Now we see everything that's going wrong With the world and those who lead it We just feel like we don't have the means To rise above and beat it So we keep waiting (Waiting) Waiting on the world to change We keep on waiting (Waiting) Waiting on the world to change It's hard to beat the system When we're standing at a distance So we keep waiting (Waiting) Waiting on the world to change Now if we had the power To bring our neighbors home from war They would have never missed a Christmas No more ribbons on their door And when you trust your television What you get is what you got Cause when they own the information, oh They can bend it all they want That's why we're waiting (Waiting) Waiting on the world to change We keep on waiting (Waiting) Waiting on the world to change It's not that we don't care We just know that the fight ain't fair So we keep on waiting (Waiting) Waiting on the world to change And we're still waiting (Waiting) Waiting on the world to change We keep on waiting (Waiting) Waiting on the world to change One day our generation Is gonna rule the population So we keep on waiting (Waiting) Waiting on the world to change Now we keep on waiting (Waiting) Waiting on the world to change We keep on waiting (Waiting) Waiting on the world to change Waiting on the world to change Waiting on the world to change Waiting on the world to change",286
36,"('Lost Without U', 'Robin Thicke')","I'm lost without you, can't help myself How does it feel to know that I love you, baby? I'm lost without you, can't help myself How does it feel to know that I love you, baby? Tell me how you love me more And how you think I'm sexy, baby That you don't want nobody else You don't want this guy, you don't want that guy You wanna touch yourself when you see me Tell me how you love my body And how I make you feel, baby You wanna roll with me, you wanna hold with me You wanna stay warm and get out of the cold with me I just love to hear you say it It makes a man feel good, baby Tell me you depend on it, I need to hear it I'm lost without you, can't help myself How does it feel to know that I love you, baby? I'm lost without you, can't help myself How does it feel to know that I love you, baby? Baby, you're the perfect shape Baby, you're the perfect weight Treat me like my birthday I want it this way, I want it that way, I want it Tell me you don't want me to stop (Don't stop) Tell me it would break your heart But you love me and all my dirty You wanna roll with me, you wanna hold with me You wanna make fires and get Norwegian wood with me I just love to hear you say it It makes a man feel good, baby I'm lost without you, can't help myself How does it feel to know that I love you baby? I'm lost without you, can't help myself How does it feel to know that I love you, baby? Cause you will tell me every morning Ooh, alright, baby Oh, yeah, oh, baby Oh, darling, alright I'm lost without you! Can't help myself How does it feel to know that I love you, baby? I'm lost without you, can't help myself How does it feel to know that I love you, baby? Ooh yeah, oh baby Oh darlin', all right-right Oh baby, oh darlin' Ooh, ooh, baby, all right-right",366
37,"(""I'm A Flirt"", 'R. Kelly Or Bow Wow (Featuring T.I. & T-Pain)')","I'm a, I'm a, I'm a, I'm a flirt Soon as I see her walk up in the club, I'm a flirt Winking eyes at me when I roll up on them dubs, I'm a flirt Sometimes when I'm with my chick on the low, I'm a flirt And when she's with her man looking at me damn right, I'm a flirt So homie don't bring your girl to meet me cuz, I'm a flirt And baby don't bring your girlfriend to eat cuz, I'm a flirt Please believe it, unless your game is tight and you trust her Then don't bring her around me because, I'm a flirt Now swear to tell the truth and the whole truth When it comes to hoes I be pimping like I supposed to Rolling like I supposed to, shining like I supposed to In the club fucking with honeys like I supposed to I don't understand when a nigga bring his girlfriend to the club Freaking all on the floor with his girlfriend in the club And wonder why all these playas trying to holler at her Just soon as she go to the bathroom, nigga I'm gon' holler at her A dog on the prowl when I'm walking through the mall If I could man I would probably fuck with all of y'all Yeah, yeah homie you say she your girlfriend But when I step up to her I'mma be like cousin Believe me man this is how them playas do it in the Chi And plus we got them playerette flirters in the Chi Now the moral of this story is cuff your bitch Cuz hey, I'm black, handsome, I sing plus I'm rich And I'm a flirt Hey homie if you ain't got no money You better keep her away from me ya dig Well if ya love ya girl and wanna keep ya girl Don't be walkin' up and askin' me to meet ya girl Because I'm well enough a flirt when I speak to ya girl She winked her eyes on the sly, I seen cha girl Better treat girl right cuz another man will Better eat eat ya girl like another man will Cuz you leave ya wife and I see ya wife Now be for real, how long ya think that's fixin' to be ya wife Well I'm livin' the life, you just gettin' it right Ya old lady look at me cuz you ain't hittin' it right She probably used to like you cuz you the business type That's till I came along and put some dick in her life Wanna see how that ass lookin' thick in the light I noticed she was checkin' me and diggin' the ice And if I get that tonight bet I hit that twice I can even make her mine if I hit that right You know, smack that thang, sit that right Up on that dress, see yeah that's right Pullin' on her hair like we gettin' in a fight Yeah, I know it's kind of tight but it'll sweat just right So if ya girl sexy and she test me Don't be upset G cuz you might catch me Tryin' to catch a glance up her skirt, put my plan in reverse If I see her and I like her then I'm a flirt When I, when I, when I When I pull up to club all the shorties be like, damn twenty-eights Then I be like girl you know just who I am, don't hate See I done fell in love with a stripper y'all All I do is flirt with her and I get them draws And I don't need no help, I got it down pact Teddy Pain was born to flirt now you can't down that Now I'mma flirt with her whether I'm in or out of town That's why they call me Teddy Bend-Er-Ass Down I be like como se llamo, lil' mama me llamo Pain What is your name I'm feeling your vibe and I'm hoping you feel the same I'mma wink my eye and let you know I got the game When I pass by I know exactly what you say He's so fly, yes he's so cool Hey shorty, hey shorty what it do He mad cuz I'm looking but I already fucked her I got these niggas mad cuz I'm a flirt Oh, it's the remix Now if you walk in up in the club with a bad chick And if she lookin' at me then I'm gon' hit Man jackin' for chicks, I tried to quit it But I'm a playa homie so I had to hit it While you buying her drinks in the club Acting like you in love Stunting like you all thug We was switching numbers She looking at you and I walk by You turn your head, she wink her eye I can't help it if she checking for a platinum type of guy She be calling my daddy and I be calling her mommy She be calling you Kelly, when your name is Tommy I don't know what y'all be thinking when you bring 'em around me Let me remind you that I am the king of R&B Do you know what that means That means if you love your chick don't bring her to the V.I.P Cuz I might leave with your chick Just keeping it real my nigga, it's a playa's field my nigga Don't take no bitch to the club when you just met her my nigga Cuz I'mma flirt with her, right He gon' flirt with her, right And if she lickin' that good shit She gon' flirt with her I'm a flirt",958
38,"('If Everyone Cared', 'Nickelback')","From underneath the trees We watch the sky Confusing stars for satellites I never dreamed that you'd be mine But here we are, we're here tonight Singing, Amen, I I'm alive (I'm alive) Singing Amen, I I am alive If everyone cared and nobody cried If everyone loved and nobody lied If everyone shared and swallowed their pride Then we'd see the day, when nobody died And I'm singing Amen, I, Amen, I I am alive Amen, I, Amen, I, Amen, I I am alive And in the air, the fireflies Our only light in paradise We'll show the world they were wrong And teach them all to sing along Singing Amen, I I'm alive (I'm alive) Singing Amen, I I am alive If everyone cared and nobody cried If everyone loved and nobody lied If everyone shared and swallowed their pride Then we'd see the day when nobody died If everyone cared and nobody cried If everyone loved and nobody lied If everyone shared and swallowed their pride Then we'd see the day when nobody died When nobody died And as we lie beneath the stars We realize how small we are If they could love like you and me Imagine what the world could be If everyone cared and nobody cried If everyone loved and nobody lied If everyone shared and swallowed their pride Then we'd see the day when nobody died If everyone cared and nobody cried If everyone loved and nobody lied If everyone shared and swallowed their pride Then we'd see the day when nobody died We'd see the day, we'd see the day When nobody died We'd see the day, we'd see the day When nobody died We'd see the day when nobody died (Died)",291
39,"('Get It Shawty', 'Lloyd')","I guess if I can let this moment slip away Cause I got my eye on you I see you looking over your shoulder Let me make my way over Excuse me, miss lady how you doing Your body looking right You're the type I like Can I pursue and Can I get a little closer So I can get to know you And exchange names and thangs Before the night is over All I really want is for you to back it up Go on and put your weight on it Cause it's alright Do what you wanna Make me believe ya Oooh, I wanna see ya Get it shawty, get it shawty Get it shawty, get it shawty I guess if we can let the night just drift away So baby, what you gon' do Cause I don't wanna lose it Come on, keep it moving Excuse me, miss lady how you doing Your body looking right You're the type I like Can I pursue and Can I get a little closer So I can get to know you And exchange names and thangs Before the night is over All I really want is for you to back it up Go on and put your weight on it Cause it's alright Do what you wanna Make me believe ya Oooh, I wanna see ya Get it shawty, get it shawty Get it shawty, get it shawty Jeans tight, high heels This is how you make me feel Lips glossed, teeth white Apple bottoms, let me bite Spend the night, catch a flight We can do what-what you like Feeling right, ya smelling good Let get this understood Is there something you're not telling me Are you the daughter of Frankie Beverly It's the way you move The way you groove I'm a fan and you're the celebrity She doing freaky stuff Shawty got me geeked up Like Fabo I got Play-doh Let me show you street love All I really want is for you to back it up Go on and put your weight on it Cause it's alright Do what you wanna Make me believe ya Oooh, I wanna see ya Get it shawty, get it shawty Get it shawty, get it shawty",376
40,"('Face Down', 'The Red Jumpsuit Apparatus')","Hey girl, you know you drive me crazy One look puts the rhythm in my hand Still, I'll never understand why you hang around I see what's going down Cover up with makeup in the mirror Tell yourself, ""It's never gonna happen again"" You cry alone, and then He swears he loves you Do you feel like a man when you push her around? Do you feel better now, as she falls to the ground? Well, I'll tell you my friend, one day this world's going to end As your lies crumble down, a new life she has found A pebble in the water makes a ripple effect Every action in this world'll bear a consequence If you wade around forever, you will surely drown I see what's going down I see the way you go and say you're right again Say you're right again, heed my lecture Do you feel like a man when you push her around? Do you feel better now as she falls to the ground? Well, I'll tell you my friend, one day this world's going to end As your lies crumble down, a new life she has found Face down in the dirt, she said, ""This doesn't hurt"" She said, ""I finally had enough"" Face down in the dirt, she said, ""This doesn't hurt"" She said, ""I finally had enough"" One day she will tell you that she has had enough It’s coming 'round again Do you feel like a man when you push her around? Do you feel better now as she falls to the ground? Well, I'll tell you my friend, one day this world's going to end As your lies crumble down, a new life she has found Do you feel like a man when you push her around? Do you feel better now as she falls to the ground? Well, I'll tell you my friend, one day this world's going to end As your lies crumble down, a new life she has found Face down in the dirt, she said, ""This doesn't hurt"" She said, ""I finally had enough""",349
